<?xml version="1.0" encoding="utf-8" standalone="no"?>

<!DOCTYPE book SYSTEM "http://www.uludag.org.tr/style/uludagbook.dtd"
[
  <!ENTITY projectname "Uludağ">
]>


<book version="0.1" lang="tr" type="webpage">

  <bookinfo>
    <title>Projects</title>

    <author author_id="1">
      <firstname>Erkan</firstname>
      <lastname>Tekman</lastname>
      <address>
        <email>tekman@uludag.org.tr</email>
      </address>
    </author>
    <author author_id="2">
      <firstname>Barış</firstname>
      <lastname>Metin</lastname>
      <address>
        <email>baris@uludag.org.tr</email>
	<web>http://www.metin.org</web>
      </address>
    </author>

    <pubdate>2004-01-09</pubdate>
    <revhistory>
      <revision author_id="1">
        <revnumber>1.0</revnumber>
	<date>2004-01-09</date>
      </revision>
    </revhistory>

    <abstract>
      <para>
      We think it is essential to define sub-projects within Uludag to exploit parallel development and concurrent engineering methodologies. We prefer to do this by dividing Uludag into three layers.
      </para>
    </abstract>
  </bookinfo>


  <chapter>
    <sect1>
      <title>Core Layer</title>
      <para>
	This is the software packages and their connection to the system, which is <em>sine qua non</em> of Uludag, or any distribution.

        <orderedlist>
          <listitem>Packages Projects: Adapting the software packaging and preparing them for distribution.</listitem>
          <listitem>Package Management System Project: The configuration tool that handles the installation and management of application packages.</listitem>
          <listitem>Configuration Tools Project: The framework and the tools that takes care of configuration of the operating system and important applications.</listitem>
          <listitem>Installer Project: The software that installs the operating system onto a brand new or in use system.</listitem>
	</orderedlist>
      </para>
    </sect1>

    <sect1>
      <title>Presentation Layer</title>
      <para>
        The components that Uludag use to interface with the user.

        <orderedlist>
          <listitem>Turkish Project: Translating the operating system and the applications to Turkish, and guaranteeing that the Turkish characters and fonts work flawlessly.</listitem>
          <listitem>Graphics &amp; Media Project: Designing all visual and audio components of the desktop and the documents.</listitem>
          <listitem>Human-Computer Interaction Project: Developing all Uludag projects through a human-centric design approach and obeying the usability criteria.</listitem>
	</orderedlist>
      </para>
    </sect1>

    <sect1>
      <title>Auxiliary Layer</title>
      <para>
	The components which are not necessary <em>per se</em>, nevertheless of utmost importance for sustainability of Uludag.

        <orderedlist>
          <listitem>Quality Assurance Project: Defining, documenting and monitoring all the production processes of Uludag.</listitem>
          <listitem>Contributor Relations Project: Managing the relations with the developers who are volunteer to contribute to Uludag project.</listitem>
          <listitem>Developer System Project: Designing, deploying and managing the infrastructure that will be employed by all Uludag projects.</listitem>
	</orderedlist>
      </para>
    </sect1>
   </chapter>
</book>
