<?xml version="1.0" encoding="utf-8" standalone="no"?>

<!DOCTYPE book SYSTEM "http://www.uludag.org.tr/style/uludagbook.dtd"
[
]>

<book version="0.1" lang="tr" type="webpage">

  <bookinfo>
    <title>Belgeler</title>

    <author author_id="1">
      <firstname>Erkan</firstname>
      <lastname>Tekman</lastname>
      <address>
        <email>tekman@uludag.org.tr</email>
      </address>
    </author>
    <author author_id="1">
      <firstname>Barış</firstname>
      <lastname>Metin</lastname>
      <address>
	<email>baris@uludag.org.tr</email>
        <web>http://www.metin.org</web>
      </address>
    </author>

    <pubdate>2004-01-10</pubdate>
    <revhistory>
      <revision author_id="1">
        <revnumber>1.0</revnumber>
	<date>2004-01-10</date>
      </revision>
    </revhistory>

    <abstract>
      <para>
        Ulusal Dağıtım kapsamında oluşturulacak her tür (basılı, elektronik, çokluortam, vb.) belgenin hazırlanması Belgeler projesinin sorumluluğundadır. Belgelerde tutarlı bir üslup ve doku kullanılması en temel gereklerden biridir.
     </para>
   </abstract>
  </bookinfo>

  <chapter>
    <sect1>
      <para>
        Ulusal Dağıtım Belgeler Projesi kapsamında:
	<numberedlist>
	  <listitem>Kullanıcı ve geliştiricilere yönelik tüm belgeler belirlenecek ve sınıflandırılacak,</listitem>
	  <listitem>Bu belgelerin hazırlanma işi yürütülecek, yaptırılacak ve eşgüdümü sağlanacak,</listitem>
	  <listitem>Ulusal Dağıtım iç, dış ve geliştirici web sitelerinin enformasyon mimarisi ve içerik yönetimi yapılacak,</listitem>
	  <listitem>Belgeler sisteminin enformasyon mimarisi ve içerik yönetimi yapılacak,</listitem>
	  <listitem>Diğer projelerde oluşturulacak kılavuzların hazırlanmasında rol alacak,</listitem>
	  <listitem>Katkıcılardan gelen belgelerin kabul testleri yürütülecek, bu testler için süreç tanımı yapılacak ve kılavuz hazırlanacak.</listitem>
	</numberedlist>
      Proje iletişim: Zerrin Çakmakkaya, <email>zerrin@uludag.org.tr</email>
      </para>
    </sect1>
  </chapter>

</book>
