<?xml version="1.0" encoding="utf-8" standalone="no"?>

<!DOCTYPE book SYSTEM "http://www.uludag.org.tr/style/uludagbook.dtd"
[
  <!ENTITY projectname "Ulusal Dağıtım">
]>


<book version="0.1" lang="tr" type="webpage">

  <bookinfo>
    <title>Projeler</title>

    <author author_id="1">
      <firstname>Erkan</firstname>
      <lastname>Tekman</lastname>
      <address>
        <email>tekman@uludag.org.tr</email>
      </address>
    </author>
    <author author_id="2">
      <firstname>Barış</firstname>
      <lastname>Metin</lastname>
      <address>
        <email>baris@uludag.org.tr</email>
	<web>http://www.metin.org</web>
      </address>
    </author>

    <pubdate>2004-01-09</pubdate>
    <revhistory>
      <revision author_id="1">
        <revnumber>1.0</revnumber>
	<date>2004-01-09</date>
      </revision>
    </revhistory>

    <abstract>
      <para>
      Ulusal Dağıtım'da paralel geliştirme ve eşzamanlı mühendislik yöntemlerini kullanabilmek için alt projeler tanımlananın yerinde olduğunu düşünüyoruz. Bu tanımlamaları da Ulusal Dağıtım'ı üç kavramsal katmana bölerek yürütmeyi uygun bulduk.
      </para>
    </abstract>
  </bookinfo>


  <chapter>
    <sect1>
      <title>Çekirdek Katmanı</title>
      <para>
        Ulusal Dağıtım'ın olmazsa olmazı yazılım paketleri ve bu paketlerin sistemle bağlantısını sağlayan temel bileşenler.

        <orderedlist>
          <listitem><link url="/projeler/paketler/">Paketler Projesi</link>: Uygulama paketlerini uyarlama ve dağıtıma hazırlama işi.</listitem>
          <listitem><link url="/projeler/pisi/">Paket Yönetim Sistemi Projesi</link>: Uygulama paketlerinin kurulumu ve yönetimini düzenleyen yapılandırma aracı.</listitem>
          <listitem><link url="/projeler/comar/">Yapılandırma Araçları Projesi</link>: İşletim sisteminin ve önemli uygulamaların yapılandırmalarını düzenleyen çerçeve ve araçlar.</listitem>
          <listitem><link url="/projeler/yali/">Kurulum Projesi</link>: İşletim sisteminin boş ya da kullanımdaki bir sisteme yüklenmesini sağlayan yazılım.</listitem>
	</orderedlist>
      </para>
    </sect1>
    
    <sect1>
      <title>Gösterim Katmanı</title>
      <para>
        Ulusal Dağıtım'ın kullanıcı ile arayüzünde kullandığı bileşenler.

        <orderedlist>
          <listitem><link url="/projeler/turkce/">Türkçe Projesi</link>: İşletim sistemi ve uygulamaların çevirilerinin yapılması ve Türkçe karakterler ve yazıtipleri ile uyumunun sağlanması işi.</listitem>
          <listitem><link url="/projeler/grafik/">Grafik &amp; Medya Projesi</link>: Masaüstü ve belgelerin görsel ve işitsel unsurlarının tasarlanması işi.</listitem>
          <listitem><link url="/projeler/ibe/">İnsan-Bilgisayar Etkileşimi Projesi</link>: Tüm Ulusal Dağıtım projelerinin insan merkezli tasarım yaklaşımı ile ve kullanışlılık ilkelerine uyarak şekillendirilmesi işi.</listitem>
	</orderedlist>
      </para>
    </sect1>
	   
    <sect1>
      <title>Yardımcı Katman</title>
      <para>
Ulusal Dağıtım'ın sürdürülebilirliğini sağlayacak olan, ancak dağıtımın kendisi için doğrudan gerekli olmayan bileşenler.

        <orderedlist>
          <listitem><link url="/projeler/kalite/">Kalite Güvence Projesi</link>: Ulusal Dağıtım'ın tüm üretim süreçlerinin tanımlanması, belgelenmesi ve izlenmesi işi.</listitem>
          <listitem><link url="/projeler/iliskiler/">Katkıcı İlişkileri Projesi</link>: Ulusal Dağıtım projesine katkıda bulunmak isteyen kişilerle ilişkilerin yürütülmesi.</listitem>
          <listitem><link url="/projeler/gelistirici/">Geliştirici Sistemi Projesi</link>: Tüm Ulusal Dağıtım projelerinin yürütüleceği altyapı ve hizmetlerin tasarlanması, kurulması ve sunulması işi.</listitem>
	</orderedlist>
      </para>
    </sect1>
   </chapter>
</book>
