<?xml version="1.0" encoding="utf-8" standalone="no"?>

<!DOCTYPE book SYSTEM "http://www.uludag.org.tr/style/uludagbook.dtd"
[
]>

<book version="0.1" lang="tr" type="webpage">

  <bookinfo>
    <title>Who We Are</title>

    <author author_id="1">
      <firstname>Erkan</firstname>
      <lastname>Tekman</lastname>
      <address>
        <email>tekman@uludag.org.tr</email>
      </address>
    </author>
    <author author_id="1">
      <firstname>Barış</firstname>
      <lastname>Metin</lastname>
      <address>
	<email>baris@uludag.org.tr</email>
        <web>http://www.metin.org</web>
      </address>
    </author>

    <pubdate>2004-01-10</pubdate>
    <revhistory>
      <revision author_id="1">
        <revnumber>1.0</revnumber>
	<date>2004-01-10</date>
      </revision>
    </revhistory>

    <abstract>
      <para>
        Uludag developers and their contact info are listed below.
      </para>
    </abstract>
  </bookinfo>

  <chapter>
    <sect1>
    <para>
      <orderedlist>

      <listitem>
	A. Murat Eren
	<descriptivelist>
         <listitem>E-Mail: <email>meren@uludag.org.tr</email></listitem>
	 <listitem>Web: <link url="http://cekirdek.uludag.org.tr/~meren/">http://cekirdek.uludag.org.tr/~meren/</link></listitem>
	</descriptivelist>
      </listitem>				      

      <listitem>
	Alp Öztarhan
	<descriptivelist>
	  <listitem>E-Mail: <email>alp@uludag.org.tr</email></listitem>
	</descriptivelist>
      </listitem>

      <listitem>
	Ayşe Genç
	<descriptivelist>
	  <listitem>E-Mail: <email>ayse@uludag.org.tr</email></listitem>
	</descriptivelist>
      </listitem>

      <listitem>
	Barış Metin 
	<descriptivelist>
	  <listitem>E-Mail: <email>baris@uludag.org.tr</email></listitem>
	  <listitem>Web: <link url="http://cekirdek.uludag.org.tr/~baris/">http://cekirdek.uludag.org.tr/~baris/</link></listitem>
	  <listitem>Web: <link url="http://www.metin.org">http://www.metin.org</link></listitem>
	</descriptivelist>
      </listitem>

      <listitem>
        Erkan Tekman
	<descriptivelist>
	  <listitem>E-Mail: <email>tekman@uludag.org.tr</email></listitem>
	  <listitem>Web: <link url="http://cekirdek.uludag.org.tr/~tekman/">http://cekirdek.uludag.org.tr/~tekman/</link></listitem>
	</descriptivelist>
      </listitem>

      <listitem>
        Serdar Köylü
	<descriptivelist>
	  <listitem>E-Mail: <email>serdar@uludag.org.tr</email></listitem>
	</descriptivelist>
      </listitem>

      <listitem>
        Zerrin Çakmakkaya
	<descriptivelist>
	  <listitem>E-Mail: <email>zerrin@uludag.org.tr</email></listitem>
	</descriptivelist>
      </listitem>
      </orderedlist>
    </para>
    </sect1>
  </chapter>

</book>
