<?xml version="1.0" encoding="utf-8" standalone="no"?>

<!DOCTYPE book SYSTEM "http://www.uludag.org.tr/style/uludagbook.dtd"
[
]>

<book version="0.1" lang="tr" type="webpage">

  <bookinfo>
    <title>Installer</title>

    <author author_id="1">
      <firstname>Erkan</firstname>
      <lastname>Tekman</lastname>
      <address>
        <email>tekman@uludag.org.tr</email>
      </address>
    </author>
    <author author_id="1">
      <firstname>Barış</firstname>
      <lastname>Metin</lastname>
      <address>
	<email>baris@uludag.org.tr</email>
        <web>http://www.metin.org</web>
      </address>
    </author>

    <pubdate>2004-01-10</pubdate>
    <revhistory>
      <revision author_id="1">
        <revnumber>1.0</revnumber>
	<date>2004-01-10</date>
      </revision>
    </revhistory>

    <abstract>
      <para>
	The installer software is the system that installs the operating system and the user's choice application from the installation media (CD, network, internet, etc.) quickly and problem-free. It is expected to end up with a functional system which requires no further configuration when the installer application finishes, which is generally used only once.
      </para>
    </abstract>
  </bookinfo>

  <chapter>
    <sect1>
      <para>
        Within the scope of Uludag Installer Project:
	<numberedlist>
	  <listitem>An installation scenario will be written,</listitem>
	  <listitem>This scenario will be put through user tests and usability aspects will be examined,</listitem>
	  <listitem>A user interface will be designed for the finalized scenario,</listitem>
	  <listitem>The requirements for the software to run underneath this interface/scenario will be determined,</listitem>
	  <listitem>The interface/scenario will be iterated until technical feasibility is reached,</listitem>
	  <listitem>The graphics and media tasks for the installer will be outsourced,</listitem>
	  <listitem>The installer software will be designed and coded,</listitem>
	  <listitem>The final acceptance tests will be carried out on the real system.</listitem>
	</numberedlist>
        Project contact: Barış Metin, <email>baris@uludag.org.tr</email>
      </para>
    </sect1>
  </chapter>

</book>
