<?xml version="1.0" encoding="utf-8" standalone="no"?>

<!DOCTYPE book SYSTEM "http://www.uludag.org.tr/style/uludagbook.dtd"
[
  <!ENTITY projectname "Ulusal Dağıtım">
]>


<book version="0.1" lang="tr" type="webpage">

  <bookinfo>
    <title>&projectname; Subversion Deposu</title>

    <author author_id="1">
      <firstname>Barış</firstname>
      <lastname>Metin</lastname>
      <address>
        <email>baris@uludag.org.tr</email>
	<web>http://www.metin.org</web>
      </address>
    </author>

    <pubdate>2004-04-27</pubdate>
    <revhistory>
      <revision author_id="1">
        <revnumber>1.0</revnumber>
	<date>2004-04-27</date>
      </revision>
    </revhistory>

    <abstract>
      <para>
        Projenin ürünlerinin sunulduğu Subversion sürüm kontrol sistemidir.
      </para>
    </abstract>
  </bookinfo>


  <chapter>
    <sect1>
      <title>&projectname; deposu</title>
      <para>
        &projectname; Subversion deposuna web üzerinden göz atmak için <link url="http://www.uludag.org.tr/uludag-xml/">http://www.uludag.org.tr/uludag-xml</link> adresini kullanabilirsiniz. Bağlantı web üzerinden gösterim için yapılandırılmıştır.
      </para>
      <para>
        Aslen, depoya ulaşmak için <link url="http://svn.uludag.org.tr/uludag/">http://svn.uludag.org.tr/uludag</link> adresi kullanılmalıdır.
      </para>
      <para>
        Kendi çalışma kopyanızı (working copy) oluşturup üzerinde çalışmak için;
        <command>svn co http://svn.uludag.org.tr/uludag</command>
        komutunu kullanabilirsiniz.
      </para>
      <para>
        Subversion hakkında bilgi almak için <link url="http://svnbook.red-bean.com/">http://svnbook.red-bean.com/</link> adresindeki Subversion kitabını kullanabilirsiniz.
      </para>
    </sect1>

    <sect1>
      <title>svn-commits e-posta listesi</title>
      <para>
        <link url="http://liste.uludag.org.tr/cgi-bin/mailman/listinfo/svn-commits">http://liste.uludag.org.tr/cgi-bin/mailman/listinfo/svn-commits</link> adresinden üye olabileceğiniz liste, Subversion deposundaki değişiklikleri anlık olarak e-posta adresinize gönderecektir.
      </para>
    </sect1>

  </chapter>
	   
</book>
