<?xml version="1.0" encoding="utf-8" standalone="no"?>

<!DOCTYPE book SYSTEM "http://www.uludag.org.tr/style/uludagbook.dtd"
[
]>

<book version="0.1" lang="tr" type="webpage">

  <bookinfo>
    <title>Kurulum</title>

    <author author_id="1">
      <firstname>Erkan</firstname>
      <lastname>Tekman</lastname>
      <address>
        <email>tekman@uludag.org.tr</email>
      </address>
    </author>
    <author author_id="1">
      <firstname>Barış</firstname>
      <lastname>Metin</lastname>
      <address>
	<email>baris@uludag.org.tr</email>
        <web>http://www.metin.org</web>
      </address>
    </author>

    <pubdate>2004-01-10</pubdate>
    <revhistory>
      <revision author_id="1">
        <revnumber>1.0</revnumber>
	<date>2004-01-10</date>
      </revision>
    </revhistory>

    <abstract>
      <para>
        Kurulum yazılımı, işletim sistemi ve kullanıcının seçeceği paketleri hızlı ve sorunsuz olarak kurulum medyasından (CD, ağ, İnternet, vb.) sisteme indiren ve yerleştiren sistemdir. Bir kez kullanılması beklenen kurulum yazılımının çalışması sona erdiğinde tercihen daha fazla yapılandırılması gerekmeyen işlevsel bir sistem oluşması beklenmektedir.
      </para>
    </abstract>
  </bookinfo>

  <chapter>
    <sect1>
      <para>
        Ulusal Dağıtım Kurulum Projesi kapsamında:
	<numberedlist>
	  <listitem>Kurulum senaryosu oluşturulacak,</listitem>
	  <listitem>Bu senaryo denekler üzerinde uygulanarak kullanışlılık açısından gözden geçirilecek,</listitem>
	  <listitem>Son haline getirilen senaryonun kullanıcı arayüzü oluşturulacak,</listitem>
	  <listitem>Bu senaryo/arayüz altında çalışacak yazılım için gerekler belirlenecek,</listitem>
	  <listitem>Teknik olabilirlik sağlanana kadar senaryo/arayüz üzerinde değişiklikler yapılacak,</listitem>
	  <listitem>Kurulumun grafik ve medya işleri yaptırılacak,</listitem>
	  <listitem>Kurulum yazılımı tasarlanacak ve kodlanacak,</listitem>
	  <listitem>Gerçek sistem üzerinde son testler yapılacak ve müşteri kabulü gerçekleştirilecek.</listitem>
	</numberedlist>
        Proje iletişim: Barış Metin, <email>baris@uludag.org.tr</email>
      </para>
    </sect1>
  </chapter>

</book>
