<?xml version="1.0" encoding="utf-8" standalone="no"?>

<!DOCTYPE book SYSTEM "http://www.uludag.org.tr/style/uludagbook.dtd"
[
]>

<book version="0.1" lang="tr" type="webpage">

  <bookinfo>
    <title>İnsan-Bilgisayar Etkileşimi</title>

    <author author_id="1">
      <firstname>Erkan</firstname>
      <lastname>Tekman</lastname>
      <address>
        <email>tekman@uludag.org.tr</email>
      </address>
    </author>
    <author author_id="1">
      <firstname>Barış</firstname>
      <lastname>Metin</lastname>
      <address>
	<email>baris@uludag.org.tr</email>
        <web>http://www.metin.org</web>
      </address>
    </author>

    <pubdate>2004-01-10</pubdate>
    <revhistory>
      <revision author_id="1">
        <revnumber>1.0</revnumber>
	<date>2004-01-10</date>
      </revision>
    </revhistory>

    <abstract>
      <para>
        Ulusal Dağıtım hedefleri arasında kolay kurulabilen ve kullanılabilen bir dağıtım oluşturmak yer aldığından en önemli projelerimizden birisi İnsan-Bilgisayar Etkileşimi projesi olacak.
      </para>
    </abstract>
  </bookinfo>

  <chapter>
    <sect1>
      <para>
	      Ulusal Dağıtım İnsan - Bilgisayar Etkileşimi Projesi kapsamında:
	      <numberedlist>
	        <listitem>Uygulama, sistem, vb. için kağıt maketler tasarlanacak ve hazırlatılacak,</listitem>
	        <listitem>Kullanışlılık testleri yapılacak/yaptırılacak, kullanışlılık raporları yazılacak/yazdırılacak,</listitem>
	        <listitem>Kurulum, Yapılandırma Araçları ve Grafik &amp; Medya projeleri başta olmak üzere tüm projelere kullanışlılık ve İBE desteği verilecek,</listitem>
	        <listitem>Dağıtım için kullanışlılık ve İBE kuralları belirlenecek ve kılavuzu hazırlanacak,</listitem>
	        <listitem>Katkıcılardan gelen uygulamaların kullanışlılık ve İBE kabul testleri yürütülecek, bu testler için süreç tanımı yapılacak ve kılavuz hazırlanacak.</listitem>
	      </numberedlist>
	      Proje iletişim: Serdar Köylü, <email>serdar@uludag.org.tr</email>
	    </para>
    </sect1>
  </chapter>

</book>
